[
  {
    "id": "platformer-template",
    "name": "Platformer Template",
    "description": "Complete side-scrolling platformer template with gravity-based movement, collectibles, enemies, and multiple levels. Perfect for creating classic 2D platformer games with modern polish.",
    "version": "1.0.0",
    "category": "platformer",
    "difficulty": "beginner",
    "slots": [
      {
        "id": "player-character",
        "name": "Player Character",
        "description": "The main character that the player controls",
        "type": "component",
        "required": true,
        "multiple": false,
        "acceptedTypes": ["player"],
        "defaultValue": "player-sprite"
      },
      {
        "id": "platform-tiles",
        "name": "Platform Tiles",
        "description": "Ground and platform components for level structure",
        "type": "component", 
        "required": true,
        "multiple": true,
        "acceptedTypes": ["platform"],
        "defaultValue": "platform-ground"
      },
      {
        "id": "collectibles",
        "name": "Collectible Items",
        "description": "Items for players to collect (coins, gems, power-ups)",
        "type": "component",
        "required": false,
        "multiple": true,
        "acceptedTypes": ["collectible"],
        "defaultValue": "collectible-item"
      },
      {
        "id": "enemies",
        "name": "Enemy Characters", 
        "description": "Hostile entities that provide challenge",
        "type": "component",
        "required": false,
        "multiple": true,
        "acceptedTypes": ["enemy"],
        "defaultValue": "basic-enemy"
      },
      {
        "id": "background-layers",
        "name": "Background Layers",
        "description": "Scrolling background elements for atmosphere",
        "type": "component",
        "required": false,
        "multiple": true,
        "acceptedTypes": ["background"],
        "defaultValue": "scrolling-background"
      },
      {
        "id": "ui-elements",
        "name": "User Interface",
        "description": "HUD elements like health, score, and menus",
        "type": "component",
        "required": false,
        "multiple": true,
        "acceptedTypes": ["ui"],
        "defaultValue": "ui-display"
      },
      {
        "id": "sound-effects",
        "name": "Sound Effects",
        "description": "Audio feedback for actions and events",
        "type": "component",
        "required": false,
        "multiple": true,
        "acceptedTypes": ["sound"],
        "defaultValue": "sound-effect"
      },
      {
        "id": "visual-effects",
        "name": "Visual Effects",
        "description": "Particle effects and animations",
        "type": "component",
        "required": false,
        "multiple": true,
        "acceptedTypes": ["particle"],
        "defaultValue": "particle-effect"
      }
    ],
    "requiredSystems": ["input-handler", "physics-movement", "collision-detection", "animation-controller"],
    "requiredMechanics": ["platformer-movement"],
    "sceneGraph": {
      "root": {
        "id": "game-world",
        "name": "Game World",
        "type": "root",
        "properties": {
          "backgroundColor": "#87CEEB",
          "ambientSound": "nature-ambient"
        },
        "children": [
          {
            "id": "background-layer",
            "name": "Background Layer",
            "type": "layer",
            "properties": {
              "depth": -100,
              "parallax": 0.3
            }
          },
          {
            "id": "gameplay-layer",
            "name": "Gameplay Layer", 
            "type": "layer",
            "properties": {
              "depth": 0,
              "parallax": 1.0
            }
          },
          {
            "id": "foreground-layer",
            "name": "Foreground Layer",
            "type": "layer",
            "properties": {
              "depth": 100,
              "parallax": 1.2
            }
          },
          {
            "id": "ui-layer",
            "name": "UI Layer",
            "type": "layer",
            "properties": {
              "depth": 1000,
              "parallax": 0.0
            }
          }
        ]
      },
      "scenes": [
        {
          "id": "level-1",
          "name": "Level 1",
          "width": 3200,
          "height": 600,
          "backgroundColor": "#87CEEB",
          "entities": [
            {
              "componentId": "player-sprite",
              "position": { "x": 100, "y": 400 },
              "configuration": {
                "speed": 200,
                "jumpHeight": 300,
                "health": 3
              }
            },
            {
              "componentId": "platform-ground",
              "position": { "x": 0, "y": 550 },
              "configuration": {
                "width": 800,
                "height": 50,
                "solid": true
              }
            },
            {
              "componentId": "platform-ground",
              "position": { "x": 1000, "y": 450 },
              "configuration": {
                "width": 200,
                "height": 32,
                "oneWayUp": true
              }
            },
            {
              "componentId": "collectible-item",
              "position": { "x": 300, "y": 500 },
              "configuration": {
                "value": 10,
                "itemType": "coin"
              }
            },
            {
              "componentId": "collectible-item",
              "position": { "x": 1100, "y": 400 },
              "configuration": {
                "value": 50,
                "itemType": "gem"
              }
            },
            {
              "componentId": "basic-enemy",
              "position": { "x": 600, "y": 500 },
              "configuration": {
                "health": 1,
                "speed": 80,
                "patrolDistance": 100
              }
            },
            {
              "componentId": "scrolling-background",
              "position": { "x": 0, "y": 0 },
              "configuration": {
                "scrollSpeed": 0.3,
                "parallaxFactor": 0.2
              }
            }
          ]
        },
        {
          "id": "level-2",
          "name": "Level 2",
          "width": 4000,
          "height": 800,
          "backgroundColor": "#FFB347",
          "entities": [
            {
              "componentId": "player-sprite", 
              "position": { "x": 100, "y": 650 },
              "configuration": {
                "speed": 220,
                "jumpHeight": 320,
                "health": 3
              }
            },
            {
              "componentId": "platform-ground",
              "position": { "x": 0, "y": 750 },
              "configuration": {
                "width": 1200,
                "height": 50,
                "solid": true
              }
            }
          ]
        }
      ]
    },
    "defaultConfiguration": {
      "gravity": 980,
      "playerLives": 3,
      "scoreSystem": true,
      "levelTransitions": true,
      "checkpoints": true
    },
    "gameSettings": {
      "screenWidth": 1024,
      "screenHeight": 768,
      "targetFPS": 60,
      "physics": {
        "enabled": true,
        "gravity": 980
      },
      "audio": {
        "enabled": true,
        "volume": 0.7
      }
    },
    "buildTargets": ["desktop", "web"],
    "tags": ["platformer", "2d", "side-scrolling", "gravity", "jumping"],
    "preview": {
      "image": "platformer-template-preview.png",
      "video": "platformer-template-demo.mp4"
    },
    "documentation": {
      "tutorial": "This template provides everything needed for a classic 2D platformer. Start by customizing the player character's movement feel, then design levels using platforms and obstacles. Add enemies for challenge and collectibles for progression.",
      "examples": [
        {
          "title": "Simple Platformer",
          "description": "Basic setup for a beginner-friendly platformer",
          "configuration": {
            "gravity": 800,
            "playerLives": 5,
            "checkpoints": true
          }
        },
        {
          "title": "Challenging Platformer",
          "description": "More difficult setup for experienced players",
          "configuration": {
            "gravity": 1200,
            "playerLives": 1,
            "checkpoints": false
          }
        }
      ]
    },
    "createdAt": "2024-01-01T00:00:00.000Z",
    "updatedAt": "2024-01-01T00:00:00.000Z"
  },
  {
    "id": "shooter-template",
    "name": "Shooter Template",
    "description": "Action-packed shooter template supporting both top-down and side-scrolling perspectives. Includes weapon systems, enemy AI, wave spawning, and score-based progression.",
    "version": "1.0.0",
    "category": "shooter",
    "difficulty": "intermediate",
    "slots": [
      {
        "id": "player-character",
        "name": "Player Character",
        "description": "Armed player character with shooting capabilities",
        "type": "component",
        "required": true,
        "multiple": false,
        "acceptedTypes": ["player"],
        "defaultValue": "player-sprite"
      },
      {
        "id": "enemy-types",
        "name": "Enemy Types",
        "description": "Various enemy characters with different behaviors",
        "type": "component",
        "required": true,
        "multiple": true,
        "acceptedTypes": ["enemy"],
        "defaultValue": "basic-enemy"
      },
      {
        "id": "environmental-objects",
        "name": "Environmental Objects",
        "description": "Cover, obstacles, and destructible objects",
        "type": "component",
        "required": false,
        "multiple": true,
        "acceptedTypes": ["platform", "decoration"],
        "defaultValue": "platform-ground"
      },
      {
        "id": "power-ups",